A1: Sender Node Name | B1: Message Name | C1: Deadline (ms) | D1: Message ID | E1: Source Node Type | F1: Replication Type | G1: Base CAN ID
A2: Door Control | B2: DoorMotorCommand | C2: 10 | D2: 1000 | E2: 183 | F2: hall,side | G2: =CONCATENATE("0x",RIGHT(CONCATENATE("00000000",DEC2HEX(1*POWER(2,27)+D2*POWER(2,16)+E2*POWER(2,8))),8)) -> 0x0BE8B700
A3: Level Sensor | B3: Level | C3: 10 | D3: 1050 | E3: 150 | F3: direction | G3: =CONCATENATE("0x",RIGHT(CONCATENATE("00000000",DEC2HEX(1*POWER(2,27)+D3*POWER(2,16)+E3*POWER(2,8))),8)) -> 0x0C1A9600
A4: Door reversal Sensor | B4: DoorReversal | C4: 10 | D4: 1100 | E4: 100 | F4: hallway,side | G4: =CONCATENATE("0x",RIGHT(CONCATENATE("00000000",DEC2HEX(1*POWER(2,27)+D4*POWER(2,16)+E4*POWER(2,8))),8)) -> 0x0C4C6400
A5: Drive Control | B5: DriveSpeed | C5: 10 | D5: 1150 | E5: 181 | F5: none | G5: =CONCATENATE("0x",RIGHT(CONCATENATE("00000000",DEC2HEX(1*POWER(2,27)+D5*POWER(2,16)+E5*POWER(2,8))),8)) -> 0x0C7EB500
A6: Drive Control | B6: DriveCommand | C6: 10 | D6: 1200 | E6: 181 | F6: none | G6: =CONCATENATE("0x",RIGHT(CONCATENATE("00000000",DEC2HEX(1*POWER(2,27)+D6*POWER(2,16)+E6*POWER(2,8))),8)) -> 0x0CB0B500
A7: At Floor Sensor | B7: AtFloor | C7: 50 | D7: 1250 | E7: 40 | F7: floor,hallway | G7: =CONCATENATE("0x",RIGHT(CONCATENATE("00000000",DEC2HEX(1*POWER(2,27)+D7*POWER(2,16)+E7*POWER(2,8))),8)) -> 0x0CE22800
A8: Car Level Position Sensor | B8: CarLevelPosition | C8: 50 | D8: 1300 | E8: 60 | F8: none | G8: =CONCATENATE("0x",RIGHT(CONCATENATE("00000000",DEC2HEX(1*POWER(2,27)+D8*POWER(2,16)+E8*POWER(2,8))),8)) -> 0x0D143C00
A9: Dispatcher | B9: DesiredDwell | C9: 50 | D9: 1350 | E9: 182 | F9: hallway | G9: 0x0D46B600
A10: Dispatcher | B10: DesiredFloor | C10: 50 | D10: 1400 | E10: 182 | F10: none | G10: 0x0D78B600
A11: Safety Sensor | B11: EmergencyBrake | C11: 50 | D11: 1450 | E11: 20 | F11: none | G11: 0x0DAA1400
A12: Car Button | B12: CarCall | C12: 100 | D12: 1500 | E12: 185 | F12: floor,hallway | G12: 0x0DDCB900
A13: Door Closed Sensor | B13: DoorClosed | C13: 100 | D13: 1550 | E13: 80 | F13: hallway,side | G13: 0x0E0E5000
A14: Hall Button | B14: HallCall | C14: 100 | D14: 1600 | E14: 184 | F14: floor,hallway,side | G14: 0x0E40B800
A15: Door Opened Sensor | B15: DoorOpened | C15: 200 | D15: 1650 | E15: 160 | F15: hallway,side | G15: 0x0E72A000
A16: Hoistway Limit Sensor | B16: HoistwayLimit | C16: 200 | D16: 1700 | E16: 180 | F16: direction | G16: 0x0EA4B400
A17: Weight Sensor | B17: CarWeight | C17: 200 | D17: 1750 | E17: 120 | F17: none | G17: 0x0ED67800
A18: Weight Sensor | B18: CarWeightAlarm | C18: 200 | D18: 1800 | E18: 140 | F18: none | G18: 0x0F088C00

F1: Field 1 | I1: Field 2 | L1: Field 3 | O1: Total Bit Len | P1: Total Byte Len | Q1: Best Case Msg Len | R1: Worst Case Msg Len | S1: Best Case BW (bits/sec) | T1: Worst Case BW (bits/sec)
A2: Sender Node Name | B2: Message Name | C2: Base CAN ID | D2: Replication Count | E2: Deadline (ms) | F2: Desc | G2: Type | H2: Bit Len | I2: Desc | J2: Type | K2: Bit Len | L2: Desc | M2: Type | N2: Bit Len
A3: Door Control | B3: DoorMotorCommand | C3: 0x0BE8B700 | D3: 4 | E3: 10 | F3: door command | G3: enum | H3: 2 | O3: =SUM(H3) -> 2 | P3: =CEILING(I3/8,1) -> 1 | Q3: =J3*8+67 -> 75 | R3: =K3+FLOOR((54+J3*8)/4,1) -> 90 | S3: =K3*(1000/$E3)*$D3 -> 30000 | T3: =L3*(1000/$E3)*$D3 -> 36000
A4: Level Sensor | B4: Level | C4: 0x0C1A9600 | D4: 2 | E4: 10 | F4: Level sensing | G4: boolean | H4: 1 | O4: =SUM(H4) -> 1 | P4: =CEILING(I4/8,1) -> 1 | Q4: =J4*8+67 -> 75 | R4: =K4+FLOOR((54+J4*8)/4,1) -> 90 | S4: =K4*(1000/$E4)*$D4 -> 15000 | T4: =L4*(1000/$E4)*$D4 -> 18000
A5: Door reversal Sensor | B5: DoorReversal | C5: 0x0C4C6400 | D5: 4 | E5: 10 | F5: Door reversing | G5: boolean | H5: 1 | O5: =SUM(H5) -> 1 | P5: =CEILING(I5/8,1) -> 1 | Q5: =J5*8+67 -> 75 | R5: =K5+FLOOR((54+J5*8)/4,1) -> 90 | S5: =K5*(1000/$E5)*$D5 -> 30000 | T5: =L5*(1000/$E5)*$D5 -> 36000
A6: Drive Control | B6: DriveSpeed | C6: 0x0C7EB500 | D6: 1 | E6: 10 | F6: current drive speed | G6: double | H6: 9 | I6: direction | J6: enum | K6: 2 | O6: =SUM(H6) -> 11 | P6: =CEILING(I6/8,1) -> 2 | Q6: =J6*8+67 -> 83 | R6: =K6+FLOOR((54+J6*8)/4,1) -> 100 | S6: =K6*(1000/$E6)*$D6 -> 8300 | T6: =L6*(1000/$E6)*$D6 -> 10000
A7: Drive Control | B7: DriveCommand | C7: 0x0CB0B500 | D7: 1 | E7: 10 | F7: commanded speed | G7: enum | H7: 2 | I7: direction | J7: enum | K7: 2 | O7: =SUM(H7) -> 4 | P7: =CEILING(I7/8,1) -> 1 | Q7: =J7*8+67 -> 75 | R7: =K7+FLOOR((54+J7*8)/4,1) -> 90 | S7: =K7*(1000/$E7)*$D7 -> 7500 | T7: =L7*(1000/$E7)*$D7 -> 9000
A8: At Floor Sensor | B8: AtFloor | C8: 0x0CE22800 | D8: 10 | E8: 50 | F8: At a floor sensing | G8: boolean | H8: 1 | O8: =SUM(H8) -> 1 | P8: =CEILING(I8/8,1) -> 1 | Q8: =J8*8+67 -> 75 | R8: =K8+FLOOR((54+J8*8)/4,1) -> 90 | S8: =K8*(1000/$E8)*$D8 -> 15000 | T8: =L8*(1000/$E8)*$D8 -> 18000
A9: Car Level Position Sensor | B9: CarLevelPosition | C9: 0x0D143C00 | D9: 1 | E9: 50 | F9: car position sensing | G9: integer | H9: 16 | I9: =SUM(H9) ->  | O9: 16 | P9: =CEILING(I9/8,1) -> 2 | Q9: =J9*8+67 -> 83 | R9: =K9+FLOOR((54+J9*8)/4,1) -> 100 | S9: =K9*(1000/$E9)*$D9 -> 1660 | T9: =L9*(1000/$E9)*$D9 -> 2000
A10: Dispatcher | B10: DesiredDwell | C10: 0x0D46B600 | D10: 1 | E10: 50 | F10: setting dwell | G10: long | H10: 3 | O10: 3 | P10: 1 | Q10: 75 | R10: 90 | S10: 1500 | T10: 1800
A11: Dispatcher | B11: DesiredFloor | C11: 0x0D78B600 | D11: 1 | E11: 50 | F11: setting floor | G11: integer | H11: 3 | I11: hallway | J11: enum | K11: 2 | L11: direction | M11: enum | N11: 2 | O11: 7 | P11: 1 | Q11: 75 | R11: 90 | S11: 1500 | T11: 1800
A12: Safety Sensor | B12: EmergencyBrake | C12: 0x0DAA1400 | D12: 1 | E12: 50 | F12: Ebrake | G12: boolean | H12: 1 | O12: 1 | P12: 1 | Q12: 75 | R12: 90 | S12: 1500 | T12: 1800
A13: Car Button | B13: CarCall | C13: 0x0DDCB900 | D13: 10 | E13: 100 | F13: car button pressed | G13: boolean | H13: 1 | O13: 1 | P13: 1 | Q13: 75 | R13: 90 | S13: 7500 | T13: 9000
A14: Door Closed Sensor | B14: DoorClosed | C14: 0x0E0E5000 | D14: 4 | E14: 100 | F14: check door closed | G14: boolean | H14: 1 | O14: 1 | P14: 1 | Q14: 75 | R14: 90 | S14: 3000 | T14: 3600
A15: Hall Button | B15: HallCall | C15: 0x0E40B800 | D15: 17 | E15: 100 | F15: hall button pressed | G15: boolean | H15: 1 | O15: 1 | P15: 1 | Q15: 75 | R15: 90 | S15: 12750 | T15: 15300
A16: Door Opened Sensor | B16: DoorOpened | C16: 0x0E72A000 | D16: 4 | E16: 200 | F16: check door opened | G16: boolean | H16: 1 | O16: 1 | P16: 1 | Q16: 75 | R16: 90 | S16: 1500 | T16: 1800
A17: Hoistway Limit Sensor | B17: HoistwayLimit | C17: 0x0EA4B400 | D17: 2 | E17: 200 | F17: hoistway end sensor | G17: boolean | H17: 1 | O17: 1 | P17: 1 | Q17: 75 | R17: 90 | S17: 750 | T17: 900
A18: Weight Sensor | B18: CarWeight | C18: 0x0ED67800 | D18: 1 | E18: 200 | F18: car weight sensing | G18: integer | H18: 14 | O18: 14 | P18: 2 | Q18: 83 | R18: 100 | S18: 415 | T18: 500
A19: Weight Sensor | B19: CarWeightAlarm | C19: 0x0F088C00 | D19: 1 | E19: 200 | F19: car weight alarm | G19: boolean | H19: 1 | O19: 1 | P19: 1 | Q19: 75 | R19: 90 | S19: 375 | T19: 450
R20: Total bw | S20: =SUM(M3:M9) -> 138250 | T20: =SUM(N3:N9) -> 165950